<?xml version="1.0" encoding="UTF-8"?>
<AuthResponse xmlns:xsi="http://www.w3.org/2001/XMLSchema-instance" xsi:noNamespaceSchemaLocation="e:\svn\be-svn\decision\config\authen.xsd">
	<auth>
		<username>test</username>
		<sessionToken>898798jhjhgggdayq81</sessionToken>
		<authInstant>11:20:25</authInstant>
		<authenticatedBy>http://localhost:8000/authenticate</authenticatedBy>
		<expiry>5</expiry>
	</auth>
	<authz>
		<roles>
			<role name="BU"/>
		</roles>
	</authz>
</AuthResponse>
